{
  "schema_version": "1.0",
  "library": "Shopee BR — case history, relist freeze and authorisation",
  "source_tier": "platform_official",
  "source_url": "https://seller.shopee.com.br/edu/article/16318",
  "source_excerpt": "Anúncios banidos podem ser restabelecidos assim que a violação for resolvida. Anúncios excluídos pela Shopee não podem ser recuperados e incorrerão pontos no sistema de Pontos de Penalidade do Vendedor da Shopee. Itens com o alcance limitado também retornam assim que houver a correção indicada.",
  "last_verified": "2026-10-27",
  "notes": "These rules use sentinel triggers: the relist and duplicate engines inject a token into the field under inspection, because the verdict comes from a cross-record comparison that a text pattern cannot express. The rule then governs severity, decision and required evidence.",
  "rules": [
    {
      "rule_id": "SBR-RL-001",
      "title": "Listing is attached to an open violation case",
      "category": "relist_freeze",
      "description": "The product is already associated with a case that the platform has not closed. A banned listing can be restored once the violation is resolved, and a listing with limited reach returns once the indicated correction is made — so the listing must not be treated as clean while its case is open. This rule raises the listing for a human decision; it does not by itself block.",
      "trigger_conditions": [
        {
          "field": "any_text",
          "operator": "contains_any",
          "value": [
            "__OPEN_CASE_SIGNAL__"
          ]
        }
      ],
      "severity": "medium",
      "decision": "flag_for_review",
      "evidence_required": [
        "case_id",
        "platform_notice",
        "remediation_evidence"
      ],
      "human_review_required": true,
      "source_url": "https://seller.shopee.com.br/edu/article/16318",
      "source_tier": "platform_official",
      "source_excerpt": "Itens com o alcance limitado também retornam assim que houver a correção indicada.",
      "last_verified": "2026-10-27",
      "status": "active",
      "version": 1,
      "tags": [
        "case",
        "open",
        "review"
      ],
      "notes": "Sentinel trigger. The reviewer injects __OPEN_CASE_SIGNAL__ when the product id appears in a case whose status is open/under_review/awaiting_evidence. The distinction matters: an enforced case freezes (SBR-DUP-003), an open case only asks for a review."
    },
    {
      "rule_id": "SBR-RL-002",
      "title": "Listing was removed by the platform and cannot be recovered",
      "category": "relist_freeze",
      "description": "A listing deleted by Shopee cannot be recovered and incurs penalty points; a banned listing can be restored only once the violation is resolved. Re-submitting a removed listing therefore has to be blocked until the original case is closed and the operator has approved the remediation.",
      "trigger_conditions": [
        {
          "field": "any_text",
          "operator": "contains_any",
          "value": [
            "__REMOVED_LISTING_SIGNAL__"
          ]
        }
      ],
      "severity": "high",
      "decision": "freeze_relist",
      "evidence_required": [
        "original_case_id",
        "platform_notice",
        "remediation_evidence",
        "approval_record"
      ],
      "human_review_required": true,
      "source_url": "https://seller.shopee.com.br/edu/article/16318",
      "source_tier": "platform_official",
      "source_excerpt": "Anúncios excluídos pela Shopee não podem ser recuperados e incorrerão pontos no sistema de Pontos de Penalidade do Vendedor da Shopee.",
      "last_verified": "2026-10-27",
      "status": "active",
      "version": 1,
      "tags": [
        "case",
        "removed",
        "freeze"
      ],
      "notes": "Sentinel trigger, injected when the product id appears in a case whose status records a platform removal (blocked/relist_frozen/escalated/rejected)."
    },
    {
      "rule_id": "SBR-AU-001",
      "title": "Restricted item published without complete authorisation evidence",
      "category": "authorization",
      "description": "A restricted-category item may only be listed with the supporting documentation the platform requires. When the authorisation file is incomplete — for example an invoice but no ANVISA registration for a health product — the listing must not go live on the documentation it has.",
      "trigger_conditions": [
        {
          "field": "history",
          "operator": "contains_any",
          "value": [
            "missing",
            "authorization_documents"
          ]
        }
      ],
      "severity": "high",
      "decision": "require_evidence",
      "evidence_required": [
        "anvisa_registration",
        "distribution_authorization",
        "supplier_invoice",
        "homologation_certificate"
      ],
      "human_review_required": true,
      "source_url": "https://seller.br.shopee.cn/edu/article/12544",
      "source_tier": "platform_official",
      "source_excerpt": "O vendedor é responsável por garantir que os produtos anunciados estejam em conformidade com a legislação brasileira, com as normas dos órgãos reguladores aplicáveis e com as políticas da Shopee.",
      "last_verified": "2026-10-27",
      "status": "active",
      "version": 1,
      "tags": [
        "authorization",
        "restricted",
        "evidence"
      ],
      "notes": "The product's `history.authorization_documents` / `history.missing` fields carry the document inventory. This rule reads them as a text blob because the history object is flattened for rule matching."
    },
    {
      "rule_id": "SBR-AC-001",
      "title": "Seller penalty points recorded for the account",
      "category": "account_penalty",
      "description": "The account has accumulated penalty points. Penalty points are assigned on Mondays; when the store enters a penalty band the restrictions apply after one week and last 14 to 28 days. A store under a penalty band must have every listing reviewed before publication, because a new violation in that window escalates the restriction.",
      "trigger_conditions": [
        {
          "field": "history",
          "operator": "regex",
          "value": "(?i)(penalty_points|pontos_de_penalidade)\\W{0,4}\\W{0,4}(\\d{1,3})"
        }
      ],
      "severity": "high",
      "decision": "require_evidence",
      "evidence_required": [
        "penalty_points_summary",
        "appeal_record"
      ],
      "human_review_required": true,
      "source_url": "https://seller.shopee.com.br/edu/article/16316/o-que-sao-pontos-de-penalidade",
      "source_tier": "platform_official",
      "source_excerpt": "Desde 01 de julho, as penalizações não são mais aplicadas de forma imediata: como os pontos de penalidade são atribuídos sempre às segundas-feiras.",
      "last_verified": "2026-10-27",
      "status": "active",
      "version": 1,
      "tags": [
        "penalty",
        "account"
      ],
      "notes": "The account-level penalty summary is attached to each product's `history` block when the operator supplies it. The rule reads the point count out of that blob."
    },
    {
      "rule_id": "SBR-AC-002",
      "title": "Pending appeal deadline on a penalty point",
      "category": "account_penalty",
      "description": "An appeal against a penalty point has a deadline and can be filed only once per violation. A listing that is the subject of a pending appeal must not be republished until the appeal is resolved, because the appeal evidence depends on the listing as it was actioned.",
      "trigger_conditions": [
        {
          "field": "history",
          "operator": "contains_any",
          "value": [
            "appeal_pending",
            "appeal_deadline"
          ]
        }
      ],
      "severity": "medium",
      "decision": "flag_for_review",
      "evidence_required": [
        "appeal_record",
        "order_id",
        "platform_notice"
      ],
      "human_review_required": true,
      "source_url": "https://seller.shopee.com.br/edu/article/16316/o-que-sao-pontos-de-penalidade",
      "source_tier": "platform_official",
      "source_excerpt": "Você pode recorrer apenas uma vez para cada infração atestada na sua Central do Vendedor.",
      "last_verified": "2026-10-27",
      "status": "active",
      "version": 1,
      "tags": [
        "penalty",
        "appeal",
        "deadline"
      ]
    }
  ]
}