{
  "schema_version": "1.0",
  "library": "Shopee BR — medicines and health products",
  "source_tier": "platform_official",
  "source_url": "https://seller.br.shopee.cn/edu/article/7379",
  "source_excerpt": "De acordo com a política da Shopee, anúncios que vendem medicamentos controlados (sem licenciamento apropriado), drogas ilícitas ou suplementos de saúde com informações falsas e enganosas serão excluídos.",
  "last_verified": "2026-10-27",
  "notes": "IMPORTANT — this library encodes a policy change dated 6 August 2026. Since then Shopee is Anvisa-authorised to sell over-the-counter medicines (MIPs), but ONLY by regularly licensed pharmacies and drugstores that follow the category's and the agency's regulations strictly, per Resolução-RE nº 3.056/2026. A seller that is not a licensed pharmacy/drugstore therefore still may not list medicines at all. Any rule written before 2026-08-06 that treats ALL medicines as prohibited is out of date; this library separates the two cases explicitly.",
  "rules": [
    {
      "rule_id": "SBR-MED-001",
      "title": "Prohibited medicine categories (human, veterinary, abortifacient, injectable, MMS)",
      "category": "prohibited_item",
      "description": "Shopee maintains a hard restriction on the kinds of medicine that may be sold at all. Not permitted: human-use medicines in general; veterinary medicines; medicines, products or services related to the performance of abortions; sodium chlorite, chlorine dioxide (CDS) or Miracle Mineral Solution (MMS) in any form or presentation; injectable or intravenous solutions for medical or cosmetic purposes; illicit drugs; veterinary medicines. Listing these means the announcement is removed, penalty points are incurred, and the account may be suspended or temporarily closed depending on severity.",
      "trigger_conditions": [
        {
          "field": "any_text",
          "operator": "regex",
          "value": "(?<![a-zA-Zà-ÿÀ-ß])(clorito\\s+de\\s+s[óo]dio|dióxido\\s+de\\s+cloro(\\s+(CDS|mms))?|solu[çc][ãa]o\\s+mineral\\s+milagrosa|medicamento\\s+abortivo|inje[tç]?[aá]ve(is|l)?|intravenoso|medicamento\\s+veterin[aá]rio|droga\\s+il[íi]cita)(?![a-zA-Zà-ÿÀ-ß])"
        }
      ],
      "severity": "critical",
      "decision": "block",
      "evidence_required": [
        "product_photographs",
        "supplier_invoice",
        "anvisa_registration"
      ],
      "human_review_required": true,
      "source_url": "https://seller.br.shopee.cn/edu/article/7379",
      "source_tier": "platform_official",
      "source_excerpt": "Medicamentos de uso humano em geral; Medicamentos de uso veterinário; Medicamentos, produtos ou serviços que estejam relacionados com a realização de abortos; Clorito de sódio, dióxido de cloro (CDS) ou soluções minerais milagrosas (MMS), em todas as suas formas e apresentações;",
      "last_verified": "2026-10-27",
      "status": "active",
      "version": 2,
      "tags": [
        "medicine",
        "prohibited",
        "critical",
        "anvisa"
      ],
      "notes": "This rule deliberately does NOT fire on the generic word 'medicamento' — see SBR-MED-002, which handles the licensing question. Firing on the generic word would block every supplement listing and would be wrong after the 6 Aug 2026 Anvisa authorisation. 2026-10-28 集成修复：`inje[çc][ãa]vel` 拼写缺口（只能匹配不存在的“injecável”，漏掉葡语标准拼法 injetável/injetáveis）→ `inje[tç]?[aá]ve(is|l)?`，使“注射类药品”条款实际生效（肉毒毒素、填充剂等注入剂落入 SBR-MED-001 阻断层）。"
    },
    {
      "rule_id": "SBR-MED-002",
      "title": "Medicine listed by a seller that is not a licensed pharmacy or drugstore",
      "category": "restricted_item",
      "description": "Since 6 August 2026 Shopee is Anvisa-authorised to sell over-the-counter medicines (medicamentos isentos de prescrição, MIPs), but ONLY by regularly licensed pharmacies and drugstores that follow the category's and the agency's regulations strictly, per Resolução-RE nº 3.056/2026. A seller without that authorisation may not list medicines at all, even when the medicine itself is an MIP. Announcements selling controlled medicines without appropriate licensing are removed and incur penalty points.",
      "trigger_conditions": [
        {
          "field": "any_text",
          "operator": "regex",
          "value": "(?<![a-zA-Zà-ÿÀ-ß])(medicamento\\s+(isento\\s+de\\s+prescri[çc][ãa]o|MIP)|remédio\\s+isento\\s+de\\s+prescri[çc][ãa]o|medicamento\\s+controlado|medicamento\\s+com\\s+tarja)(?![a-zA-Zà-ÿÀ-ß])"
        }
      ],
      "severity": "high",
      "decision": "require_evidence",
      "evidence_required": [
        "anvisa_registration",
        "pharmacy_license",
        "distribution_authorization",
        "supplier_invoice"
      ],
      "human_review_required": true,
      "source_url": "https://seller.br.shopee.cn/edu/article/7379",
      "source_tier": "platform_official",
      "source_excerpt": "Desde 6 de agosto de 2026, a Shopee está autorizada pela Anvisa a comercializar medicamentos isentos de prescrição (MIPs), apenas por farmácias e drogarias regularmente licenciadas que sigam rigorosamente todas as regulamentações da categoria e da agência, conforme a Resolução-RE nº 3.056/2026.",
      "last_verified": "2026-10-27",
      "status": "active",
      "version": 1,
      "tags": [
        "medicine",
        "restricted",
        "anvisa",
        "license",
        "policy_change_2026_08_06"
      ],
      "notes": "The decision is require_evidence, not block: the medicine may be legitimate and the seller may be a licensed pharmacy. The evidence list is what separates the two cases. A seller that cannot produce the pharmacy/drugstore licence must not list the item."
    },
    {
      "rule_id": "SBR-MED-003",
      "title": "Health supplement with false or misleading information",
      "category": "consumer_protection",
      "description": "Announcements selling health supplements with false and misleading information are removed. Health supplements themselves (vitamins, herbs, natural products) are permitted, but the claims attached to them are what the platform enforces on.",
      "trigger_conditions": [
        {
          "field": "any_text",
          "operator": "regex",
          "value": "(?<![a-zA-Zà-ÿÀ-ß])(suplemento\\s+de\\s+sa[úu]de\\s+com\\s+informa[çc][õo]es?\\s+(falsas?|enganosas?)|cura\\s+garantida|100%\\s+eficaz|emagrece\\s+com\\s+garantia|apitoxina|apitoxin|veneno\\s+de\\s+abelha|bee\\s+venom)(?![a-zA-Zà-ÿÀ-ß])"
        }
      ],
      "severity": "high",
      "decision": "flag_for_review",
      "evidence_required": [
        "manufacturer_claim_reference",
        "product_photographs"
      ],
      "human_review_required": true,
      "source_url": "https://seller.br.shopee.cn/edu/article/7379",
      "source_tier": "platform_official",
      "source_excerpt": "anúncios que vendem medicamentos controlados (sem licenciamento apropriado), drogas ilícitas ou suplementos de saúde com informações falsas e enganosas serão excluídos.",
      "last_verified": "2026-10-27",
      "status": "active",
      "version": 2,
      "tags": [
        "supplement",
        "claims",
        "anvisa"
      ],
      "notes": "2026-10-28 集成补齐：正则补蜂毒/蜂毒肽化妆成分（apitoxina / apitoxin / veneno de abelha / bee venom）—— 平台政策未明文禁止该成分，按本条 flag_for_review 语义降级处理（不得阻断），与词库组 restrito_apitoxina（internal_risk）联动。"
    },
    {
      "rule_id": "SBR-MED-004",
      "title": "Regulated catalogue match — registration / licence evidence required",
      "category": "consumer_protection",
      "description": "Listing text matches a product, active ingredient, commercial name, holder, manufacturer or category registered in an ANVISA / CTI / MAPA regulated catalogue. A catalogue match is NOT a violation on its own: being registered means the item is a controlled subject, so it must be qualified with the seller's authorisation, licence and labelling. Action is require_evidence, never block — the catalogue alone cannot establish that a sale is prohibited.",
      "trigger_conditions": [
        {
          "field": "any_text",
          "operator": "contains_any",
          "value": [],
          "requires_input": [
            "title",
            "description"
          ]
        }
      ],
      "severity": "medium",
      "decision": "require_evidence",
      "evidence_required": [
        "regulator_registration_or_licence",
        "seller_authorisation",
        "product_labelling",
        "product_photographs"
      ],
      "human_review_required": true,
      "source_url": "https://bvsms.saude.gov.br/bvs/saudelegis/anvisa/2008/rdc0096_17_12_2008.html",
      "source_tier": "law",
      "source_excerpt": "Dispõe sobre a propaganda, publicidade, informação e outras práticas cujo objetivo seja a divulgação ou promoção comercial de medicamentos.",
      "last_verified": "2026-10-28",
      "status": "active",
      "version": 2,
      "tags": [
        "anvisa",
        "catalogue",
        "registration",
        "food",
        "medicine",
        "sanitation",
        "agrochemical",
        "cti",
        "signal_only"
      ],
      "notes": "2026-10-28: 词库并入 20.5 万条 ANVISA/CTI 开放数据目录词。目录登记 ≠ 平台明文禁词，仅作成分级资格核验信号；命中后须人工收集注册/许可/标签证据，不得据命中直接下架或阻断。 本规则的触发由词库目录组命中驱动（lexicon_rule_map.json 中 catalog_* 组 → SBR-MED-004），trigger_conditions 仅声明输入依赖，不做文本正则匹配。 2026-10-29 B2：source_url 从截断的 docs/bvsms/.../rdc_96_2008_（已 404）切到 saudelegis 路径 rdc0096_17_12_2008.html；source_excerpt 同步指向该 RDC 的 abuse/deception advertising 条款。注意：RDC 96/2008 是《药品广告规范》，不是直接 MIP 清单，支撑 MED-004 的“目录命中→登记 ≠ 禁售”语义仍合法（法律 tier，require_evidence 动作与 tier 一致）。 2026-10-29 B2：source_excerpt 恢复为 RDC 96/2008 逐字原文（H4）；上一版误改中文释义已回退。"
    }
  ]
}
